title	content
'Heretic' debuts with $11 million, but 'Venom’ sequel tops box office again	New York  Venom: The Last Dance has not been a blockbuster in North American theaters. But in a lethargic fall moviegoing season, even a so-so performing superhero sequel can rule the box office for … [+4567 chars]
The 2025 Oscars are shaping up to be one weird, depressing night	Ive got voting on the brain.  Thats right, its only 120 days till the Oscars.  And, this year, the race to the Academy Awards is starting to feel like the current presidential election cycle: frantic… [+3719 chars]
Historian slams ‘Gladiator II’ as ‘total Hollywood bulls–t’	Ridley Scott’s upcoming “Gladiator II” film has already drawn criticism — despite having yet to be released.   Dr. Shadi Bartsch, a leading historian and classics professor at the University of Chica… [+3274 chars]
Paul Mescal refused to give up these 2 vices for ‘Gladiator 2’ physique — here’s where he ‘drew a line’	Paul Mescal was ready to enter the arena on his own terms.  The “Gladiator II” star revealed that while getting into peak physical condition for the upcoming film, there were two things he refused to… [+3021 chars]
Do you need to watch 'Gladiator' before seeing the sequel? What to remember	"Its been nearly 25 years, but the Oscar-winning Gladiator is back! Or, at least, a sequel is!   True, ""Gladiator"" star Russell Crowe cant return as Maximus (for obvious reasons), but Gladiator II  is… [+4016 chars]"
Is ‘Glicked’ the new ‘Barbenheimer’? ‘Wicked’ and ‘Gladiator II’ collide in theaters	Barbenheimer was a phenomenon impossible to manufacture. But, more than a year later, that hasnt stopped people from trying to make Glicked or even Babyratu happen.  The counterprogramming of Barbie … [+5634 chars]
Gladiator II gay kiss cut from final edit, reveals Denzel Washington: ‘I think they got chicken’	Denzel Washington has revealed that he embraced Ancient Romes inclusive attitude towards homosexuality for Gladiator II with a gay kiss, but it got cut from the final edit.  For all its gruff masculi… [+2444 chars]
[Removed]	[Removed]
Ridley Scott denies Gladiator II cut Denzel Washington’s gay kiss: ‘That’s bulls**t’	Gladiator II director Ridley Scott has denied that the filmwas meant to have a gay kiss for Denzel Washington’s character.  Despite Scotts blockbuster sequel featuring a lot of homoerotic moments, it… [+1950 chars]
[Removed]	[Removed]
[Removed]	[Removed]
