title	content
'Venom: The Last Dance' is a fun and fitting farewell to Tom Hardy's alien antics (review)	"With the exception of James Gunn's ""Guardians of the Galaxy"" trilogy, few Marvel-based superhero films of recent memory have cultivated the wicked charm, gallows humor, and delirious fun as the three… [+4381 chars]"
As ‘Venom: The Last Dance’ Arrives, It’s Time to Let Post-Credits Scenes Take Their Final Bow	[Editor’s note: The following post contains spoilers for both “Venom: The Last Dance” and its post-credits scenes.]  The wacky “Venom” franchise has stood out among the crowded superhero milieu for v… [+7327 chars]
‘Venom: The Last Dance’ Misses Projection In Domestic Box Office Weekend	"""Venon: The Last Dance.""  Sony Pictures Entertainment/Columbia Pictures  Tom Hardys Marvel comic book movie Venom: The Last Dance isn't opening with as big of numbers as initially projected.  Release… [+2326 chars]"
The Director of Venom: The Last Dance on the Idea of More Stories	Posted in: Movies, Sony, Venom | Tagged: film, sony pictures, venom, venom: the last dance  The director of the Sony Pictures film Venom: The Last Dance explains that while this is the end of Venom, … [+2815 chars]
The Saga Of Mrs. Chen: Peggy Lu On Becoming A ‘Venom’ Fan Favorite	Peggy Lu as Mrs. Chen in Venom (2018)  Courtesy of Sony Pictures  ***WARNING! The following contains light spoilers for Venom: The Last Dance!***  Peggy Lu never expected to spend this much time in t… [+3999 chars]
VENOM: THE LAST DANCE - One Of The Movie's Weirdest, Wackiest Scenes Has Been Officially Released	Venom: The Last Dance is a fun movie, but there's one moment which has left pretty much everyone scratching their heads.  The threequel establishes that Eddie Brock and Venom must not fully transform… [+2948 chars]
VENOM: THE LAST DANCE's Budget Revealed As Movie Continues To Overperform Overseas Despite U.S. Struggles	While we won't get final numbers until tomorrow, it appears Venom: The Last Dance is overperforming after making $50.8 million from 64 overseas locations through Friday.  The Sony Pictures threequel … [+2778 chars]
VENOM: THE LAST DANCE Concept Art Showcases The Final Battle, Venomized Animals, And The Xenophage	"Sony Pictures has never released ""Art of the Film"" books for the Venom movies, a shame when we're sure there are heaps of awesome designs we've yet to see for both the title character and the likes o… [+2486 chars]"
VENOM: THE LAST DANCE's CinemaScore Has Been Revealed As Opening Weekend Estimates Suddenly Drop	Ever since COVID, predicting what a movie will make at the domestic box office has become increasingly difficult. Many expected hits have flopped, while plenty of titles have massively exceeded expec… [+2537 chars]
Box Office: ‘Venom: The Last Dance’ Misses Projections by Millions as Superhero Films Popularity Continues to Crater	NEW YORK (AP) Venom: The Last Dance showed less bite than expected at the box office, collecting $51 million in its opening weekend, according to studio estimates Sunday, significantly down from the … [+2612 chars]
VENOM: THE LAST DANCE Spoiler Discussion & Poll: How Would You Rate The Lethal Protector's Threequel?	Venom: The Last Dance is now playing in theaters and, while this franchise has divided fans from the start, all signs point to Tom Hardy's supposed farewell to the role being a hit for Sony Pictures.… [+2072 chars]
VENOM: THE LAST DANCE Passes $400 Million Worldwide As The Movie Continues To Exceed Box Office Expectations	When Venom: The Last Dance opened in North America far below initial expectations - with a disappointing $51 million - it looked like Sony Pictures might have another box office flop on its hands.   … [+2796 chars]
VENOM: THE LAST DANCE Receives Surprise Election Day Box Office Boost And Breaks A Franchise Record	As we first told you earlier today, those looking to escape the U.S. Election drama flocked to theaters yesterday evening to take advantage of discounted ticket prices.   That was very good news for … [+2530 chars]
VENOM: THE LAST DANCE Exceeds Expectations During Second Weekend As It Passes $300 Million Worldwide	Venom: The Last Dance surprised box office experts last weekend by underperforming with a disappointing $51 million opening weekend.   The threequel had a better time of it overseas but was projected… [+2258 chars]
VENOM: THE LAST DANCE Earns $8.5M In Thursday Previews But Soars Overseas As Audience Score Is Revealed	Venom: The Last Dance is now playing in theaters and the Sony Pictures threequel earned a solid $8.5 million from Thursday preview screenings in the U.S.   This is, however, a franchise low as Venom … [+2233 chars]
VENOM: THE LAST DANCE Star Tom Hardy Would Return For A LOGAN-Style Movie...With An R-Rating!	At this point, the Venom franchise is what it is. Ask most fans, and they'd say it should have picked up with Eddie Brock after clashing with Spider-Man for an R-Rated series of movies about him serv… [+2533 chars]
VENOM: THE LAST DANCE Concept Art Reveals An Even More Terrifying Take On Andy Serkis' Knull	Venom: The Last Dance featured the live-action debut of the King in Black and God of the Symbiotes, Knull. Played by Andy Serkis, the big bad sent his Xenophage to Earth in a bid to retrieve Eddie Br… [+3174 chars]
METAL GEAR SOLID Creator Hideo Kojima Shares A Very Telling Review Of VENOM: THE LAST DANCE	"With a terrible 37% score on Rotten Tomatoes, Venom: The Last Dance is no critical darling. Fans seem to have enjoyed it more (it has 80% on the review aggregator's ""Popcornmeter""), but what about Me… [+2649 chars]"
VENOM: THE LAST DANCE Expected To Remain At #1 For Third Weekend After Busting A Move On Box Office Rivals	Love or hate Sony Pictures' Lethal Protector, Venom: The Last Dance will remain at #1 for a third weekend in a row heading into Veterans Day.  According to Deadline, the Marvel movie starring Tom Har… [+2569 chars]
VENOM: THE LAST DANCE: 8 Easter Eggs, References, And Cameos You Might Have Missed - SPOILERS	Venom: The Last Dance hasn't received much in the way of critical acclaim, but for the most part, fans do appear to be enjoying Sony Pictures' latest Marvel movie.   Despite taking some major liberti… [+5430 chars]
'Venom: The Last Dance' misses projections as superhero films' grip on theaters loosens	Venom: The Last Dance showed less bite than expected at the box office, collecting $51 million in its opening weekend, according to studio estimates Sunday, significantly down from the alien symbiote… [+2753 chars]
Now That The Venom Trilogy Is Over, I'll Never Forgive The Tom Hardy Franchise For Its Gravest Sin	It was an unusual weekend at the box office   for Sony Pictures. The studio had to dig a shallow grave for Tom Hanks and Robert Zemeckis’ Here, an experimental trip through the generations that doesn… [+4040 chars]
Venom: The Last Dance Has A Blink-And-You'll-Miss-It Ghostbusters Easter Egg (I Totally Did)	Minor spoilers for Venom: The Last Dance lie ahead, so read at your own discretion.  The time has come, as Eddie Brock and his mischievous, alien symbiote are taking their final ride in   Venom: The … [+3633 chars]
'Venom: The Last Dance' misses projections as superhero films' grip on theaters loosens	"New York  ""Venom: The Last Dance"" showed less bite than expected at the box office, collecting $51 million in its opening weekend, according to studio estimates Sunday, significantly down from the al… [+3142 chars]"
Box office bite: ‘Venom: The Last Dance’ takes ticket title; ‘Conclave’ shows strong	NEW YORK — “Venom: The Last Dance” showed less bite than expected at the box office, collecting $51 million in its opening weekend, according to studio estimates Sunday, significantly down from the a… [+2651 chars]
Venom: The Last Dance’s Thursday Box Office Sets New Low for the Trilogy	Venom: The Last Dance opened with around $8.5 million at the box office in its Thursday night previews. That’s $1.5 million less than Venom earned in 2018 and $3.1 million less than Venom: Let There … [+2495 chars]
‘Venom: The Last Dance’ Review: Brainless and Disjointed	Venom (voiced by Tom Hardy) Courtesy of Sony Pictures  The Venom film series is one of the weirder phenomena to emerge from the superhero movie boom. Based on the popular Spider-Man villain-turned-an… [+5127 chars]
Is The Venom Movie Franchise Really Over?	With the theatrical debut of Venom: The Last Dance this weekend, Sony’s Tom Hardy-starring Marvel franchise has officially reached the trilogy threshold. This new movie is the third in the series and… [+3437 chars]
The Best Comic Book Movies Directed By Women	There are a surprising amount of films based on comic books and graphic novels that are directed by women. Traditionally women have been underrepresented in directing, and while there are still way m… [+11845 chars]
'Venom: The Last Dance' misses projections as superhero films' grip on theaters loosens	NEW YORK -- NEW YORK (AP) Venom: The Last Dance showed less bite than expected at the box office, collecting $51 million in its opening weekend, according to studio estimates Sunday, significantly do… [+2624 chars]
[Removed]	[Removed]
Venom: The Last Dance omitted the greatest Thor cameo in ancient literature	Very early in the runtime of Venom: The Last Dance, the villainous Knull (Andy Serkis) monologues about his origin for the audience, explaining that an ancient encounter with a god of light caused hi… [+3653 chars]
‘Venom: The Last Dance’ takes top spot in weekend box office — but falls short of projections	NEW YORK  Venom: The Last Dance showed less bite than expected at the box office, collecting $51 million in its opening weekend, according to studio estimates Sunday, significantly down from the alie… [+3427 chars]
[Removed]	[Removed]
Venom: The Last Dance misses projections as superhero films' grip on theatres loosens	Venom: The Last Dance showed less bite than expected at the North American box office, collecting US$51 million (S$69 million) in its opening weekend, according to studio estimates Sunday (Oct 27), s… [+2678 chars]
Venom: The Last Dance review: a disappointing finale for Sony’s Spidey villain franchise	Venom: The Last Dance is a comic book movie in need of a real, present villain. The closest the film comes to that is Knull (Andy Serkis), a literal being of darkness whose relationship with the very… [+5385 chars]
Venom: The Last Dance: Peggy Lu on Michelle Williams & Marvel Future	Posted in: Interview, Movies, Sony | Tagged: michelle williams, Peggy Lu, sony pictures, tom hardy, venom: the last dance  Peggy Lu (Venom: The Last Dance) spoke to Bleeding Cool about working with M… [+4859 chars]
Venom: The Last Dance: Peggy Lu on Tom Hardy & Mrs. Chen's Popularity	Posted in: Interview, Movies, Sony, Venom | Tagged: Peggy Lu, tom hardy, Venom 3, venom: the last dance  Peggy Lu (Venom: The Last Dance) spoke to Bleeding Cool about her journey as Mrs. Chen in Sony… [+5432 chars]
'Venom: The Last Dance' misses projections as superhero films' grip on theaters loosens	NEW YORKVenom: The Last Dance showed less bite than expected at the box office, collecting $51 million in its opening weekend, according to studio estimates Sunday, significantly down from the alien … [+2759 chars]
Venom 3 Easter eggs: all the Marvel references and deep cuts in The Last Dance explained	Venom: The Last Dance is finally here, and, as you might expect, there are plenty of Easter eggs to sink your symbiote teeth into.   Picking up in the aftermath of Spider-Man: No Way Home and Venom: … [+6191 chars]
Box Office: ‘Venom: The Last Dance’ Laps Up $22 Million Opening Day — Down From Previous Entries	“Venom: The Last Dance” is two-stepping slower than its series predecessors in North America, after chowing down on $22 million from 4,131 domestic theaters across Friday and previews. That’s well be… [+4073 chars]
